{
  "schema": {
    "id": "https://aegisomega.com/schemas/cognitive-state.v1.schema.json",
    "local_path": "schemas/cognitive-state.v1.schema.json",
    "version": "1.1.0"
  },
  "system_identifier": "AEGIS-OMEGA-LIVING-ANCHOR",
  "ontology_dimensions": 8,
  "provenance": {
    "generator": "scripts/build-cognitive-manifest.py",
    "repository": "Aegis-Omega/AEGIS-OMEGA",
    "source_ref": "feat/apple-foundation-models-runtime-v1",
    "parent_state_hash": "8de11bf84d283cd248ae017c5914ef592a9d922d41cda91e59450369a72edcdb",
    "signature_mode": "GITHUB_OIDC_ATTESTATION"
  },
  "hashing": {
    "algorithm": "sha256",
    "canonicalization": "aegis-json-v1",
    "skill_hash_scope": "raw file bytes",
    "skills_root_scope": "canonical ordered array of path, sha256, and size_bytes",
    "state_hash_scope": "canonical manifest with state_hash omitted"
  },
  "skills_root_hash": "7ea79f4d61c44c9f916121f33f00b329c8cd750d73914b39c9c7fee347c2531b",
  "rotational_axis": {
    "axis_3": {
      "focus": "kinetic_entropy",
      "manifest_hash": "eb364c1cdcbb56cf884b3d6b86872f9c2493b18a19bce52c5739550cb13426bc"
    },
    "axis_6": {
      "focus": "dynamic_mutation",
      "manifest_hash": "67d00baf99122748a462cb1282a018d659fd6ec6fa6d44a20dde29eaf437279b"
    },
    "axis_9": {
      "focus": "immutable_truth",
      "manifest_hash": "b5d1b45f50444d7234a93c9f3e5360f182f1b4df8c4461e29bbe12af80b11862"
    }
  },
  "cognitive_state": {
    "agents": {
      "aegis_core": {
        "identity": "system-2-orchestrator",
        "pacing": "phi-frequency",
        "privilege_model": "least-privilege"
      },
      "automaton_2": {
        "identity": "independent-verifier",
        "phase_shift_degrees": 108,
        "chain_id": "sha256-observed-ledger",
        "constitutional_filter": {
          "mode": "adversarial-verification",
          "fail_closed": true,
          "require_parent_state_hash": true,
          "require_skill_hash_match": true,
          "max_replay_divergence": 0,
          "require_signed_transition": true
        }
      }
    },
    "tools": {
      "ingress_gateway": {
        "declared_endpoint": "/v1/open-hands/ingress",
        "policy": "least-privilege",
        "isolation_tier": "sandbox-unprivileged",
        "validation_protocol": "EventEnvelope"
      },
      "egress_stream": {
        "declared_endpoint": "/v1/open-hands/egress",
        "format": "cryptographic-event-stream",
        "filtering": "verified-state-projection"
      }
    },
    "skills": {
      "count": 62,
      "root_hash": "7ea79f4d61c44c9f916121f33f00b329c8cd750d73914b39c9c7fee347c2531b",
      "entries": [
        {
          "name": "run-aegis",
          "path": ".claude/skills/run-aegis/SKILL.md",
          "sha256": "86ee2f2f1018b3262f8547f088caa400b35183e376bcceef28767c901f34fae2",
          "size_bytes": 4970
        },
        {
          "name": "aegis-architecture",
          "path": "sovereign-omega-v2/.claude/skills/aegis-architecture/SKILL.md",
          "sha256": "3e53e9cdd8f36b74baf82ab30ae45d7b9f699770105cfcffcea477cdde1bb4be",
          "size_bytes": 3852
        },
        {
          "name": "agent-constitution",
          "path": "sovereign-omega-v2/.claude/skills/agent-constitution/SKILL.md",
          "sha256": "c54c603bda3dbff44500633b02881d3907f87d340d6b3e726871ccb3afc1f21f",
          "size_bytes": 3321
        },
        {
          "name": "agent-mesh",
          "path": "sovereign-omega-v2/.claude/skills/agent-mesh/SKILL.md",
          "sha256": "d527c8335e76f295a887642ee80620a680c8625245f71c395bdd067528997c35",
          "size_bytes": 9182
        },
        {
          "name": "anthropic-alignment",
          "path": "sovereign-omega-v2/.claude/skills/anthropic-alignment/SKILL.md",
          "sha256": "a29b529cc0e5077f59a496327ca079e148c1ec5a07303b5594b7fafa7444bdf1",
          "size_bytes": 36977
        },
        {
          "name": "audit-findings",
          "path": "sovereign-omega-v2/.claude/skills/audit-findings/SKILL.md",
          "sha256": "9d49ae21a70d2f0837588aa20b0837c0493c4926c7d1b1667e7c81acd9fd3ee1",
          "size_bytes": 3375
        },
        {
          "name": "auto-agent",
          "path": "sovereign-omega-v2/.claude/skills/auto-agent/SKILL.md",
          "sha256": "19220c6538bb7268a0b71f588e08ba87ffa7e11a8a6e5831cb3a5a84f69d20f8",
          "size_bytes": 7137
        },
        {
          "name": "automaton-workflow",
          "path": "sovereign-omega-v2/.claude/skills/automaton-workflow/SKILL.md",
          "sha256": "319cbfe61387780a133f99ec39670cbd91e6335404ce1ac04ec650ac8d322633",
          "size_bytes": 9989
        },
        {
          "name": "autopoiesis",
          "path": "sovereign-omega-v2/.claude/skills/autopoiesis/SKILL.md",
          "sha256": "9b246b58463ad7f690d8fa454091763aae43742ea8aceb95b89dd277c776d9ef",
          "size_bytes": 11156
        },
        {
          "name": "bls-threshold-aggregation",
          "path": "sovereign-omega-v2/.claude/skills/bls-threshold-aggregation/SKILL.md",
          "sha256": "74cb86606ed58ea6b566a8b8dce0d53168d6f1bfb5dd330299b80f2abb91370b",
          "size_bytes": 3682
        },
        {
          "name": "brainstorming",
          "path": "sovereign-omega-v2/.claude/skills/brainstorming/SKILL.md",
          "sha256": "5c94ce3a4bf025dde492e400810b25a1a4e68fb10a96b79b96f225ffd8178291",
          "size_bytes": 3994
        },
        {
          "name": "branch-coverage",
          "path": "sovereign-omega-v2/.claude/skills/branch-coverage/SKILL.md",
          "sha256": "bdafb45a9030c000bcf5678e45e2896918fda57b252b4f185d49d3793e94fd9d",
          "size_bytes": 7368
        },
        {
          "name": "chronology",
          "path": "sovereign-omega-v2/.claude/skills/chronology/SKILL.md",
          "sha256": "b45a32cb8fedc24c5e1406addfa06fbafddf29b5d9e3f92deb8a3f0f54c9f772",
          "size_bytes": 19004
        },
        {
          "name": "claude-api-ref",
          "path": "sovereign-omega-v2/.claude/skills/claude-api-ref/SKILL.md",
          "sha256": "f6264e3ad0be609fd0d1c9dd7a84e7d90b22dcff33742554ccb6ce97f6330cca",
          "size_bytes": 4861
        },
        {
          "name": "compact",
          "path": "sovereign-omega-v2/.claude/skills/compact/SKILL.md",
          "sha256": "2aacf25e5aa57edf0bcfc3ffce8a0dc1f7067a0e14fb9a64879df3e2c5efa63a",
          "size_bytes": 3018
        },
        {
          "name": "compaction-prep",
          "path": "sovereign-omega-v2/.claude/skills/compaction-prep/SKILL.md",
          "sha256": "2153c3541635bd7ced7d75541d9125931580c01290a59f2410738b57cf85e59b",
          "size_bytes": 5924
        },
        {
          "name": "constitutional-audit",
          "path": "sovereign-omega-v2/.claude/skills/constitutional-audit/SKILL.md",
          "sha256": "1ad319ea8ed7a7ca76327b92c933e7e0290cd54552e19ef0e003f61f75f612db",
          "size_bytes": 4815
        },
        {
          "name": "constitutional-law",
          "path": "sovereign-omega-v2/.claude/skills/constitutional-law/SKILL.md",
          "sha256": "05285be2fd17e6175b556371ade83d46b49d633a629e73027fec5b7e2fa85a9e",
          "size_bytes": 3454
        },
        {
          "name": "core-matrix",
          "path": "sovereign-omega-v2/.claude/skills/core-matrix/SKILL.md",
          "sha256": "a660358fa3787b24d7bf32a12e6e562a8be0ca88a9250ce671cfa9739880b5df",
          "size_bytes": 1662
        },
        {
          "name": "corpus-ingestion",
          "path": "sovereign-omega-v2/.claude/skills/corpus-ingestion/SKILL.md",
          "sha256": "cf83ba81553766241b2c2f7b0191269731fbad6670616b37bd2b8f612bbf815e",
          "size_bytes": 8126
        },
        {
          "name": "deploy",
          "path": "sovereign-omega-v2/.claude/skills/deploy/SKILL.md",
          "sha256": "1faba4703f79ec42f40161eb7d31b5c2481e6d261c178216df969e62b600fca0",
          "size_bytes": 6642
        },
        {
          "name": "diagnose",
          "path": "sovereign-omega-v2/.claude/skills/diagnose/SKILL.md",
          "sha256": "78138f791cf04937ba20629098683abf09ae2a4b5bb9924c0d4ee46ecf104190",
          "size_bytes": 4438
        },
        {
          "name": "dispatching-parallel-agents",
          "path": "sovereign-omega-v2/.claude/skills/dispatching-parallel-agents/SKILL.md",
          "sha256": "b21e1dabc5120e00ba15c4ecfe9c6787224a3d1e52c871fb78a93a3e4483128e",
          "size_bytes": 3381
        },
        {
          "name": "docx",
          "path": "sovereign-omega-v2/.claude/skills/docx/SKILL.md",
          "sha256": "84d81987cd9e694ac3345d96d9dd809f574da5b4a813d90b31b4f02476cd04e3",
          "size_bytes": 6371
        },
        {
          "name": "drift-check",
          "path": "sovereign-omega-v2/.claude/skills/drift-check/SKILL.md",
          "sha256": "847daaad14440f4bc03f99306faacdc11fd3021035218d098935f0b8cfff6334",
          "size_bytes": 6412
        },
        {
          "name": "enterprise",
          "path": "sovereign-omega-v2/.claude/skills/enterprise/SKILL.md",
          "sha256": "f3d5a3a23714da1c7eec9a8b508748d7c37ff0d1e89852b422b67226ce26f5ab",
          "size_bytes": 9808
        },
        {
          "name": "evening-seal",
          "path": "sovereign-omega-v2/.claude/skills/evening-seal/SKILL.md",
          "sha256": "d0e918e2374c048bbb10d353035ed10e84bb2b71f4a55e9149f095267c698457",
          "size_bytes": 5541
        },
        {
          "name": "execution-boundary",
          "path": "sovereign-omega-v2/.claude/skills/execution-boundary/SKILL.md",
          "sha256": "c52f40ede81aa701b53317a948d93ffac40cd3f7e031a13e5f94e8d2410b11d9",
          "size_bytes": 4289
        },
        {
          "name": "frozen-file-check",
          "path": "sovereign-omega-v2/.claude/skills/frozen-file-check/SKILL.md",
          "sha256": "90d477dc9bf3c12001e3b2b07a6cf598a6d3d87f9b617b66c19cf860d289f814",
          "size_bytes": 2139
        },
        {